,subreddit,selftext,title
0,leagueoflegends,"I'm playing on my smurf in Plat1-D4 elo and guess what? Every game there are at least 2 people arguing and later on someone decides to not want to win and I am being held hostage because Riot's ""punishment"" system is a big fat joke.

The ego and the desire to tell your mate he sucks is just too big I guess",We need harder punishment for ruining a game
1,leagueoflegends,"Hello Guys,  
I made the mistake of typing in chat today and was punished by my top laner for it.

[https://youtu.be/pUFsIPvwGPY](https://youtu.be/pUFsIPvwGPY)

The story of this is as follows: Top lane poppy got camped by enemy jungler, our jungler camped bot lane. Poppy said jungle should gank her lane. I said ""Jg is helping us out very much in bot lane, you are a tank so you should be ok, right?""

Poppy took offense to that and left top lane and decided to grief me for the rest of the game.

I apologize for saying anything and was simply trying to reassure poppy that the jungler was helping us out on botside so he wasn't just afk in his jungle doing nothing.

I made the mistake of telling poppy that she was a tank so she should be ok top and was punished for it.

I have tried contacting Riot support about it but you cannot provide any evidence of foul play on their website. The support ticket simply returns a webpage that says ""We see you reported this player in game, thank you for your report!""

That means that Riot won't ever view this footage right? That as long as poppy didn't type any restricted words in chat that she will not be punished for this right?

What can I do in this situation?  


Thanks",Is this reportable?
2,leagueoflegends,,Caps with insane Equalizer
3,leagueoflegends,"One really nice, and I would imagine easy feature that I would love to see in the game is a seperate ranking that you can decide when it starts tracking. This would be really nice for people switching roles/champ reworks/or people leaving a champion because of nerfs/changes/meta. Maybe you really like a champion but you hard inted them for the first 20 games. You started to learn matchups etc, and want to see how you perform overall from a certain point. It would only be for your client and wouldn't change anything else.

 Just an extra ""Stat"" page tab. Call it something like ""Chrono Stats"" or something. You can begin/reset the tracker at any time, but it just basically wipes everything from before. As someone who switched roles twice over the last 2 seasons, I find it unhelpful that my first 50 games on a role are blended in with my second 50 games on a role. There isn't much clarity there, and while I can just view my recent games to find out what I should work on, in depth cumulitive stats may be able to identify long term trends. This would literally involve minimal effort to make (I assume), the entire system is in place for each season anyways. I just think it would be a really nice feature to have available.","A nice feature on client (beside a working one lel) would be a ""Stat Reset""."
4,leagueoflegends,"Hello,  
I've been chat restricted twice for telling toxic people they are toxic (""stop blame jungler, you are toxic, thanks"" ""report X toxic behaviour""), nor trolls that they are trolls (AD Zilean midlane for example).  


Then the match history was bugged, so they managed to report me and i could'nt report them.  


Why would it be reportable behaviour ?",Why do you get chat restricted when you tell toxic people they are toxic?
5,leagueoflegends,Zyra doesn't counts.,Still no champion with a whip
6,leagueoflegends,"I just had to dodge a ranked game because our mid laner banned the jungle champ I wanted to take (with me being second pick overall) and then when I asked why, he locked in as rengar with smite and then proceeded to laugh about it. It would've been an absolute loss so I dodged to save time and LP, and yet I'm the one being punished by losing LP and having to sit through a dodge timer.

&amp;#x200B;

I'm sure it's difficult to punish behavior like this but I think it's ridiculous that I can be put in a likely losing situation and the only way I can prevent it is by doing something I don't want to do and being punished as a result, while this guy gets to go right back into another queue and potentially do the same to others.",Does Riot intend to make a system to punish trolls?
7,leagueoflegends,,Triple kirrrrrr from the young Zed player
8,leagueoflegends,"Hi Peeps,  
I made this earlier as I am a new player returning to ranked play and thought it might be useful to others. The tier list itself has been taken from [OP.GG](https://op.gg/) as I don't have the required knowledge to understand the champion strengths.   
Hope all of you guys are staying safe during this quarantine.   
\- Mickey",Top Lane Champion Counters
9,leagueoflegends,Last night and this morning I tried purchasing some RP and when I get to the page which says payment information I get an error that says “Payment cannot be completed” with some other text. Is this just happening to me?,Can’t purchase RP from the store.
10,leagueoflegends,,TRIPLE KIRRRRR FROM THE YOUNG ZED PLAYER!
11,leagueoflegends,"I live in the Maldives,  and I started playing again after 4 years, currently the best server you can get without having to go through all the setup for the Chinese server, or going through ghe Garena servers is EUNE with OCE being a close secone except for queue times, we have a lot of interested players in maldives that a turned off the game due to having to play at 200+ ping, this is the same region that had India, along with indian ocean countries, as well as other SAARC countries, that is a huge chunk of people that want to play and have to deal with a sub optimal experience",We need a South Asian Server
12,leagueoflegends,"One really nice, and I would imagine easy feature that I would love to see in the game is a seperate ranking that you can decide when it starts tracking. This would be really nice for people switching roles/champ reworks/or people leaving a champion because of nerfs/changes/meta. Maybe you really like a champion but you hard inted them for the first 20 games. You started to learn matchups etc, and want to see how you perform overall from a certain point. It would only be for your client and wouldn't change anything else. Just an extra ""Stat"" page. Like ""Chrono Stats"" or something. You can begin/reset the tracker at any time, but it just basically wipes everything from before. As someone who switched roles twice over the last 2 seasons, I find it unhelpful that my first 50 games on a role are blended in with my second 50 games on a role. There isn't much clarity there. This would literally involve minimal effort to make, the entire system is in place for each season anyways. I just think it would be a really nice feature to use.","A nice feature (besides a working client) would be a personal ""Ranking/Stat Reset"" or something like a restore point for rank."
13,leagueoflegends,"So I am watching the European Masters and my watched games count isn't increasing. I have followed the recommended troubleshooting but it hasn't worked. 

Anyone else having this/or similar issues?",Esports Watch Rewards Help!!
14,leagueoflegends,"YDN 0 - 1 GamerLegion

dominant performance from the gamers with that interesting team comp with Talyah-Poppy botland, but at the same time a very non-cordinated attempts from YDN aswell.",YDN vs. GamerLegion / EU Masters 2020 / Day 2 / Post-Match Discussion
15,leagueoflegends,"I mean, he's blind so how does he know that his armpits are properly shaved? Does he touch his armpits to feel if there is any hair left? Or how does he do it? SERIOUS QUESTION.",How does Lee Sin know that his armpits are shaved?
16,leagueoflegends,"it fucking sucks

everyone gets ranked below his rank and going through all ranks again isn't fun nor motivating, even if you win it is more of a relief than an accomplishment

the ranked is bugged, for example i was gold 2 last season (peaked gold 1) and this season i got placed silver 2 playing with 4fun players stuck BRONZE from SEASON 1 (how are they not banned for trolling ranked than playing normals idk)

some high elos will say its your elo now, thats' your MMR, but no! every player i get is super bad, and games are low quality .. take a look at my soloQ :  [https://imgur.com/a/3vPpm6l](https://imgur.com/a/3vPpm6l) 

riot should absolutely do something about this ASAP, we'r in APRIL ! at the start of the season and the game is so not fun to play",About the S10 ranked system
17,leagueoflegends,"I think Riot should consider doing a vfx update to Atlantean Syndra. Most people think that's the best skin on her but the colors and all are just soooo bad. It looks so good in the splash art with such nice blues and then in game it's just dirty water everywhere. I mean it's just a waste to let it as it is, so lackluster.",Atlantean Syndra vfx update?
18,leagueoflegends,"YDN 0 - 1 GamerLegion

Dominant performance from the gamers with that interesting comp",YDN vs. GamerLegion / EU Masters 2020 / Day 2 / Post-Match Discussion
19,leagueoflegends,[removed],Huge FPS Drops with Windows 10 2004 preview build
20,leagueoflegends,"Im literally gtting flamed by bad kids because im not ""carrying them"" as adc. GJ Riot now I get shit on in the game and flamed too because of your 200 years of experience. 10/10",Crazy how dog shitt league is right now.
21,leagueoflegends,"Hi Peeps,

Made this earlier for myself and thought others would benefit from using it.",Top Lane Champion Match Ups
22,leagueoflegends,,Bring Your Riotling to Work Day
23,leagueoflegends,If you've been experiencing random micro stuttering since you installed Valorant try uninstalling Riot Vanguard from the control panel I uninstalled it DURING a match of LoL and the stutters cleared up immediately and haven't come back since.,Riot Vanguard causing micro stuttering in league
24,leagueoflegends,[removed],Top Lane Champions Match-ups
25,leagueoflegends,[removed],That explains a lot(the kid said balance team)
26,leagueoflegends,"&amp;#x200B;

[Jhin Plague Doctor](https://preview.redd.it/9u5duo4rrlu41.png?width=1500&amp;format=png&amp;auto=webp&amp;s=961b62ac1144846bf3896acbfb287c5f479a9c59)

So this is an art made by a friend of mine inspired by the current world situation

You can find more of her work [here](https://www.instagram.com/ciadraw/).",Jhin Plague Doctor Skin Concept
27,leagueoflegends,"\-So i noticed this with my games always first one game of the day i win like 100% i will win first game of the day on ranked sometimes secconds then all other games i will loose 90% i take breaks like i play first game win then like 2h later i play i will always loose.

\-today i won 2 games then took a break played later lost 2 games then later i palyed 3rd game and lost  it as well. I lost cause my team was toxic and did not want to play they had clean push to our base something similar in all 3 of those games. 

\-Can someone help me somehow?",I think im cursed i need help please.
28,leagueoflegends,,"Maokai w go brrrrr, all skill"
29,leagueoflegends,"She has a really long range, much longer than mine as an ADC.

She can spam her Q without any real mana issues.

A successful E + the comet rune sometimes deals 500+ damage which is a lot for and ADC.",Lux is too strong right now as a support
30,leagueoflegends,"With the MSI cancellation caused by the global pandemic, the Spring 2020 split for the LCS has been relegated to a scrim split. The Champions C9 will surely have a huge leg up in practice versus their LCS competition given the level they are at, but the advantage they should have gained from going to MSI and competing at the highest level has now evaporated. The incredible 26-2 record now means nothing for the ultimate goal, the quest for the summoners cup.  

The old qualification system with points being awarded for spring and summer split with a focus on summer split did make spring split matter to a certain extent, but the playoff results were what mattered. All that really mattered was a team made that top 6 and then had good best of 5 results. The 18 games in the regular season of the spring split were then completely forgotten.  

When the decision to move to one playoff format to determine all 3 seeds was announced I was excited, but the decision to have Spring Split results not count towards seeding in worlds qualification was dumbfounding. Every regular season game should have some reflecting on seeding for the worlds qualification tournament (which in this case is only summer playoffs). If the LCS just took from Overwatch and did a split playoffs halfway through the season (after 18 games, the second round robin) to qualify for MSI, but still count the regular season record towards the summer playoffs for worlds qualification, every game throughout the season would matter. Every team will try to prepare smarter for the spring split and come out stronger. As it is now we find teams coming together finally in week 6 or later because they didn't practice as a team until a week or two before spring split started.  

Summer playoffs with its expansion to 8 teams, could see great battles between teams that struggled in spring finally get the pieces together to make a push for playoffs to make a run through the bracket. Teams who get a bunch of wins in spring should have an advantage over teams with 5 or 6 should be put at a disadvantage. While the point qualification satisfied this somewhat, that was based more on playoffs results and made the regular season games have less meaning.  

If the LCS truly want viewers to tune in to all the weekly games, a one season, 36 game format would go a long way. If we keep MSI, a mid season (after the second round robin, 18 games with current format) qualifier to determine the LCS seed would keep spring playoffs on the table, while not throwing away those 18 regular season games.",LCS needs to move to single season.
31,leagueoflegends,"A query regarding these mission doda's. Should I always have missions to complete or is there a set number of them to be completed?

My mate is telling me that I should always have missions to complete but the only mission I have and have completed is your first win of the day. 

Should I have more?",Galaxies 2020 Missions - Returning player to game
32,leagueoflegends,"I got chat restricted a few years back and my GF told me to just mute the chat altogether; team and enemies. I asked why and she just said ""instead of wasting your time and being idle for a few seconds just so you can tell them 80 reasons why they should ram their head into the wall, why not just use that time and be helpful instead of stooping to their level."". Seemed like a stupid idea at the time but from 2013/14 until now, I'm still doing it.  


Probably just me but it actually helped me focus a bit more into my games. Do you guys do the same?",Do you mute your chat?
33,leagueoflegends,[removed],Limited edition?
34,leagueoflegends,,What are the chances? (One for all)
35,leagueoflegends,"Seems logical to me, it would give more sense to the spring split.
Sending G2 / C9 / LPL winner / LCK winner directly to worlds could be considered unfair but they're really likely to qualify anyway, in the history of Lol esports only few teams that won their spring split in a major region didn't qualified for worlds afterwards.

For the seeding they could have a bye for play-ins for example, this way they would still play the summer split seriously to get a better seeding. 

What do you think of this ?",Since MSI is cancelled shouldn't Riot send the winner of Spring Split in major regions directly to worlds ?
36,leagueoflegends,"Whenever an enemy player in ranked games starts getting tilted/salty my 4 friends and I begin going as hard as we can to kill that one person, and it really works. It has resulted in numerous afks, lots of salt and often the enemy team starts getting pissed at each other tell us to ""report this blind jungler"" or report ""bg yas can't win lane and should uninstall"". We don't actually talk to them at all unless it is really egregious or vulgar and we don't bm with emotes and shit. Apparently some people think that what we do is shitty and toxic.",Is this a scumbag strat?
37,leagueoflegends,What’s the best counterpick against ranged mid laners?,champion Advice
38,leagueoflegends,Can someone tell me why I get paired with silver players every ranked game?,I keep getting paired with silver players when i'm in bronze 4?
39,leagueoflegends,Title says it. I miss dominion. I don’t like always having to commit to a 30+ minute game when I just want to play the champions! Not farm 300 minions only to die to an 8/0 Jhin at 13 minutes. The game isn’t balanced. And some of us just want to have some fun.,Bring back a non-farming game mode.
40,leagueoflegends,"Santa ornn is a good idea
Q christmas tree
His flame breath thingy can be snowy
His R can be a huge sleigh or a huge poro
His passive can show him building Toys
Recall can be also making toys",Santa Ornn
41,leagueoflegends,"Tell us your story. There sure must be hilarious names out there.

I once saw a Yuumi player named ""Snorlax"" and found it hilarious. Also, in a popular post someone also commented finding a ""CoronaVarus"".

So, what have you seen?",What is the most original summoner name you've seen on a champion main?
42,leagueoflegends,[removed],SANTA ORNN
43,leagueoflegends,,Peak performance of challenger flex games
44,leagueoflegends,"This is an art made by a friend of mine, you can support her [here at instagram](https://www.instagram.com/ciadraw/)

https://preview.redd.it/265bw6jhplu41.png?width=1500&amp;format=png&amp;auto=webp&amp;s=ca5f1d82523b82ab7caad428b9db5ab17e804523",Plague Doctor Jhin Skin Concept
45,leagueoflegends,"Just putting it out there. 4 of his 5 abilities are circles, and two of them spin around: meaning, they could easily be adapted to a galaxy sort of theme. He also flies into the air, which could also be adapted to a space theme. Not only that, but a lot like Xerath, Mordekaiser and Malphite, Galio has very broad and extended features (mainly his chest which even has something in the middle) that could also be adapted to house stars like the aforementioned. Lastly, he's huge and flashy and his Shield of Durand  is purple. 

I think this would be a cool skin. What about you all? I can try to draw concept art but it wouldn't look like it would in game due to my lack of professional art skills.",Dark Star Galio when?
46,leagueoflegends,,"Ashe gets tricked, backstabbed, and quite possibly bamboozled."
47,leagueoflegends,,Plague Doctor Jhin Skin Concept
48,leagueoflegends,"[Solo Lanes](https://i.imgur.com/i4XTrsL.png):

*Processing img smye551holu41...*

[Junglers](https://i.imgur.com/rkErL47.png):

*Processing img 1yw82ezholu41...*

[Bot Lane](https://i.imgur.com/Za5fJTj.png):

*Processing img bo19w5miolu41...*

Nope. C9 take every award...

Continuing my series, I give you the Matchup Rankings for the LCS for the entire 2020 regular season. These are the rankings looking at how players performed in champion specific matchups across the year normalized across all of professional Lol. I posted one of these at the half way point that got positive responses so I thought I should do the 2020 season and MVP. More background below.

[MVP](https://i.imgur.com/dlbxy5w.png)**:** First, I would like to point out this just includes regular season stats. I took a different approach to my MVP, essentially what I did is look at the player's win rate, his team score average, and his team's second highest performing player. I then used this too determine who was carrying their team to the highest win rate. I think it is fun to have data different than what the analysts say, but this time I think Blaber is just so convincingly the MVP. Congrats to Blaber!

*Processing img de2gf8o4olu41...*

**Background:** We see a lot of rankings based on differentials, but those have always bothered me a lot of the time. Players are playing losing champion matchups and then being attacked later (after people forget the matchups) for having a low CS differential or gold differential for the year. So I wanted to make a matchup-proof ranking.

To further elaborate, what this ranking is doing is looking at how, for example, a pro played Leblanc into Zoe and comparing against how every other mid or top laner pro player played that matchup. So if you score really high, that could mean every game this season you were down in CS, but what it would also mean, is that when other pros played that EXACT same matchup, they were even more down in CS. So, if Faker was down 15 cs in a matchup, that probably means on average, other pros were down somewhere between 20-30 cs in that same matchup, as an example, as Faker has a good score.

So what is v3. v1 and v2 did a good job of accounting for laning statistics, those are obviously still included. But I have now focused on adding three more statistics/things: roaming/towers and game effectiveness. (1) Roaming/Towers looks at how often you were involved with first bloods outside of your lane and also your gold income outside of CS. If you roam and get a kill, what did it cost? I think people tend to forget about turret plates in pro play. And (2) game effectiveness, this looks at how much damage you are doing over the amount of gold you are getting as well as your ability to translate that into wins. (Please keep in mind these stats are also normalized against champion matchups) And (3) JUNGLERS AND BOT LANES NOW INCLUDED.

[Infographic on the MVP](https://twitter.com/Data_Richy/status/1253370292916957191)

P.S. AS ALWAYS, additional shoutout to [https://oracleselixir.com/](https://oracleselixir.com/) for the data, Tim Sevenhuysen is doing great work out there.

P.P.S. The data is normalized so that you can compare across categories, a 99 doesn't mean 99 CS diff, it means 99th percentile (you are the best) for that statistic. The total is the sum across the categories","Does C9 take every award or do Jiizuke, Solo and Bjergsen have something to say? - LCS 2020 Matchup Rankings and MVP"
49,leagueoflegends,"And wow did it feel good. For years I've played on and off, usually sitting around s3. But this season I picked a main (shyvana jungle) and was able to climb into gold. I had to fight through 4 promo matches, but the highlight was definitely in those final moments of game 4.  It was a BLOODY game of nonstop aggression and we were down 7k gold, but I wanted this win so badly. We met the enemy team at elder, but they had control of the pit. Our top lane aatrox dives in 1v5, but while the enemy team turns to evaporate the poor darkin, I ulted over the wall into 3 of them, won the smite fight, and got off enough damage to kill 3 of them at the cost of my life. I may have died during the chaos, but got to watch satisfied as my team picked up another kill and managed to push down mid for a comeback victory. I felt like I EARNED that victory and my way into gold. 24 hours later and I am still elated over this win. Anyway, thanks for reading and I hope you all are staying safe and healthy during this time!","After many years of casually playing, I finally hit gold after a crazy promo game."
50,leagueoflegends,"Hi I know absolutely nothing about the game and only installed it yesterday, seems good but I have no idea what I’m doing and died 18 times with 0 kills in my first game, any tips or advice??",Complete noob
51,leagueoflegends,[removed],"Ashe gets tricked, backstabbed and possibly bamboozled."
52,leagueoflegends,"Went 10-2 and got inspired to draw her. My first time drawing her too!

 [https://i.imgur.com/aFtwTSt.png](https://i.imgur.com/aFtwTSt.png)",Shout out to all Riven mains. My favorite character and greatest Waifu
53,leagueoflegends,,AD Shyvana Penta
54,leagueoflegends,Any tips for a new starter who when 0-18 in my first game🤦🏻‍♂️😂😂,Brand new to the game I know nothing
55,leagueoflegends,[removed],Executing
56,leagueoflegends,,"Ashe gets tricked, backstabbed and possibly bamboozled."
57,leagueoflegends,So i have been playing adc's for 7 years and i don't know about you guys but i think they are a litte weak i think that an adc can't do anything they just need the supp and ya that is the thing i like that the adc roll need the supp roll but i think the supp roll is to much needed for the adc and they are weak if they don't have an supp or if the supp player is bad i want to hear you guys opinions on this i think that the supp class needs to be there and be good to have an good outcome for the adc,Are adc's weak?
58,leagueoflegends,,"What did we see in the LEC - Episode 13 - Draft Kingdom, Fight Syndrome and Toplane Diff"
59,leagueoflegends,"I just got this email from my professor and thought it was relevant because I have very bad ping + spectrum too.

Copied and Pasted/edited to not leak info (too lazy to blur out)

&amp;#x200B;

Dear students.  
Unfortunately, Spectrum is currently experiencing an internet outage in my neighborhood that has, so far, lasted all morning. I was hoping to wait it out, but it still has not been resolved. With that in mind, we unfortunately cannot have a live Zoom meeting class today.    
For HW, you have two assignments:- please read *The Curious Incident of the Dog in the Night-Time* to the end of page 83 / end of chapter 131.- please complete the simple 1 paragraph writing exercise (posted on Canvas) by the end of day tomorrow.  
xxxx, your presentation on autism and Asperger's will be pushed back until Tuesday.  I apologize to everyone for the technical inconvenience, but we will overcome it.  
Thank you all, and stay healthy and safe.",Even my professors have problem with spectrum
60,leagueoflegends,,"Shout out to all Riven mains, and my favorite Waifu"
