,subreddit,selftext,title
394,leagueoflegends,"I want to start off saying I don't think I'm good at league of legends by any means, I'm gold 2 and I've been playing a little over a year now ( since last new years ) but I've had some thoughts/opinions from paying for coaching ( I've been tryharding league about 2 months now, went from silver 4 to gold  2 after my coaching ) and there happened to be a somewhat well known coach who gave me a lot of crap when I complained about struggling to climb fast due to the # of games I had to deal with a pre-5 min afk or somebody intentinally feeding on purpose ( was a total of 7 out of 20 ranked games ).  

I brought up the topic of ""elo hell"" which in context to myself, means that the outcome of the game is no longer up to which team performs better, more which team has somebody whos not trying to lose on purpose.   

Now I know this was an excuse I was using to not winning, and I can admit that if I was good enough I'm sure maybe I could carry some of these games, but it's frustrating when I see these streamers playing saying the exact same things as lower mmr bracketed players would experience but it's only an okay excuse for them and not low mmr players.


TLDR I don't like how pros/high elo can complain and it's considered okay because ""they are pros"" but when it's talked about in lower ranks, the literal same exact thing, it's almost frowned upon to even bring up. I'm just somebody trying to improve at league of legends but it feels difficult to get better outside of fundamentals when a 3rd of my games are decided by people going 0-13 in 8 mins or afk because they died once in lane.


What are your opinions on this? Is there a difference between things or is this Hypocrisy .","Hypocrisy On ""Elo Hell"""
395,leagueoflegends,"If I don't remember wrong, the city the star guardians protect is called Valoran while the new fps game from riot is callent Valorant which I have not even seen.

Opinion people?",Question about the star guardian universe being connected to the Valorant FPS.
396,leagueoflegends,"I'm new to League. My laptop monitor has 1920x1080, and when in-game it's fullscreen, no issues. But when I get back to the menu, resolution goes back down to 1080×720, making the window smaller than it was. Whenever I change the resolution back to 1920x1080, the window is way too big and portions of the right/bottom side of the screen are cut off. Does anyone know how to fix this issue?",Client Window Size Issues
397,leagueoflegends,,Incredible Baron Steal in EDG vs. RNG
398,leagueoflegends,[removed],Is it worth to buy Galaxies Pass atm.
399,leagueoflegends,,1 Fish 2 Dead
400,leagueoflegends,"I understand the ""Recommended Items"" tab in the shop which is built for every champion in the game. But I think it should not be there after you reach level 30. 

The reason is everyone should start to learn and understand what certain items do and how to play around them, but as long as there is this part of the shop, so many people will not know the powerspikes each item represent up untill later in their experience.

Of course, begginers should be given this tab to help them and lift the item weight off their mind, and allows  them to focus on the basis of the game. But so many people build what is shown in that tab, and it is not viable in every single matchup. Moreover, the recommended items on some champions are not ideal.

Also, without this help, there would be a much higher skill ceiling across all elos. You need to have a solid knowledge about your champion and the items in order to built something correctly. Ofc, there are sites like op.gg and mobafire that show you build paths, but at least it instigates the player to search and find more things about core items and situational build, whereas in the ingame shop, something like that is merely shown.

Correct me if I am wrong. Thank you!","""Recommended Items"" tab in-game shop"
401,leagueoflegends,"Basically you can flame all you want, you can grief and troll all you want. As long as you don't use any excessive vocabulary in chat, Riot automated ban system won't catch you despite the fact you get reported every single game you play. I feel sorry for anyone who got banned/perma banned by this system, bacause they played themselves.",Riot report system is a joke
402,leagueoflegends,"Every form of slow kills kalistas ability to auto attack, because her attack speed and her jump scale together. Is this working as intended or is this just messed up.",All slows are attack speed slows on Kalista
403,leagueoflegends,Fix garena servers. You hearing? 150+ ping always. Your servers are paid unfair crap. Fix them. Stop milking server bandwidth ffs,Fix servers rito
404,leagueoflegends,"I have not been able to open league for the past 3 hours, screenshot: [https://imgur.com/a/SgUFEea](https://imgur.com/a/SgUFEea)

I've checked the official League server status and there are no warnings/updates there, so I was wondering if anyone else was experiencing this issue, or if not, does anyone know how to fix? Thanks.","""Update Server Down"""
405,leagueoflegends,[removed],Expected but still annoying
406,leagueoflegends,[removed],Where do i go to watch chinese pro players stream?
407,leagueoflegends,,Server down? It's been like this for 3 hours now but league server status shows no warnings. Any fixes if it's a local issue?
408,leagueoflegends,,Expected but still kind of annoying
409,leagueoflegends,"**Worldwide Games Ranking by March 2020 Earning: SuperData released data on Digital sales in March this year. Since many countries have quarantine, users sit at home and spend money on virtual entertainment.** 

https://preview.redd.it/j8cwsxf7cju41.jpg?width=1146&amp;format=pjpg&amp;auto=webp&amp;s=5e7f682316d08a9777ebec5d48e51363b985cf05",Worldwide Games Ranking by March 2020 Earning:
410,leagueoflegends,,"Worldwide Games Ranking by March 2020 Earning: SuperData released data on Digital sales in March this year. Since many countries have quarantine, users sit at home and spend money on virtual entertainment."
411,leagueoflegends,"I dont know if its the matchmaking or what but this game is unholy unfair. I am learning and leveling an account which takes a considerable amount of time. I am learning the game with my wife as well, we are just spamming normal and blind picks.  


I downloaded facecheck for builds and it consistently shows the people we play against are consistently plat and diamond playing with their ""friends"" in normals. This one person will end up carrying the whole game and rofl stomp us all and i can't even comprehend any gameplay because this player will roll all 5 of us. Just today, it has happened 5-6 games out of 10. We even had a grandmaster smurf on the team university of cincinatti smurfing to play with his friend and he just shat on us.  


It is so unfun playing against people that absolutely roll your whole team. You don't even know what to do besides FF, and most people won't FF. When there are diamonds and grandmasters that are just going 10 and 0 in the first 15 mins, the game is practically over unless they go brain dead.  


I think riot seriously needs to come up with a better matchmaking system for normals. I can't imagine ranked with the toxicity I hear from it and this game is seriously turning me away just based on simple, fixable matters.   


This game rocks in gameplay wise and its fun when you play a hard fought game and either win or lose. But when the game is over from the start, its full of toxic people, and its hard to FF.. There is no fun in it.  


TLDR: Game is inherently unfun based off its matchmaking and players. Its so easy for a smurf thats high ranked to smash games and you can't even gather anything from the game. Its happening more and more and turning away newer players. I'd rather play a different game than roll the dice and get a diamond player smurfing for fun with ""friends""",New player. Game is extremely unfun.
412,leagueoflegends,,Jhin's 4th Auto attack turns into a blossom? [Weird bug]
413,leagueoflegends,,ornn sorc boots rush theory craft oneshot
414,leagueoflegends,,Ah yes I understand Kata mains now.
415,leagueoflegends,,A little Elder Dragon steal and unofficial penta I did with AD Shyvana recently!
416,leagueoflegends,[removed],I hate Riot Games with a passion.
417,leagueoflegends,[removed],rushing sorc boots on ornn results in alot of balanced one shots in early lane phase
418,leagueoflegends,"Hey, i recently came back to LoL after a break and i have a little issue. Once the champ select is done and i get into the loading scrern of a match, my laptop screen gets very dim. When i alt-tab my desktop gets brighter but if i go to the match again, it's dark. Any ideas what to do?
Also Good luck and hope you have a nice day",The game is getting dark as soon as it starts
419,leagueoflegends,[removed],I FUCKING HATE RIOT
420,leagueoflegends,,"A little idea I had with ornn, what if you built first item sorc boots? here is the result, alot of damage"
421,leagueoflegends,"So anyone here from SEA server? that using Garena ? can i ask you guys why Our ms can reaching 420 ms? Well me and my friend have this kind trouble , i just need answers",Having Trouble In SEA server
422,leagueoflegends,[removed],Hey guys I made it easier for you to know why you died in lane
423,leagueoflegends,,Chad Kassadin with Electrocute and Ignite
424,leagueoflegends,Is he still relevant? I've been spamming him lately with great success. Does he fit the current meta? I think he's gonna be a reference build for years to come.,Ap tank Lee sin
425,leagueoflegends,,Hey guys I made it easier for you to know why you died in lane
426,leagueoflegends,"So i was playing jinx and in middle of the game something happened and i got a weird textured red circle around my champion which showed range, How it happened?",A Weird Red circle around my champion
427,leagueoflegends,Does anyone keep getting autofilled every 3rd game? I get to play my 2 autofill protected matches ans then i always get autofilled the next match. Super frustrating,Autofill in ranked every 3rd game.
428,leagueoflegends,,A small play I made on my quantum computer
429,leagueoflegends,[removed],Hey guys made it easier for you to know why you died in lane
430,leagueoflegends,[removed],Made it easier for you guys to know who you died in lane
431,leagueoflegends,"Heyo, I'm just getting back into League and I've been trying out support, I would really like to play with an adc if you wanna join me. I play most often 11pm to like 4am or later PST. Let me know if you wanna play, I'm pretty casual but I like to be in a chat together. :) my name is Snowsoir if you wanna add me. I'm only level 12 and I haven't played in 3ish years",Bottom lane partner for practice?
432,leagueoflegends," i have a idea , for LUX's W ,,,,,, -------Her shield was take back automatically. I suggest turning her W into a voluntary take back. This will increase her game diversity.",Advice about Lux's W
433,leagueoflegends,,"I don't often get to elder drag in my games, it was nice being able to steal it! Especially being down a level too"
434,leagueoflegends,I don’t care if you want people to love Summoner’s Rift. People feed. Farming 300 creeps for 40 minutes just flat out sucks. The game is decided so early. And it is a big deterrent for me to play league at all anymore. I wanna be able to just have an all out deathmatch with non-random champions on a map other than The Howling Abyss.,"Farming sucks, bring back Dominion."
435,leagueoflegends,"Garena server is so trash. These days it is giving 150+ ping to all players. Mine used to work at 60 but now its stuck at 150+. Its impossible to play the game. 

Riot should intervene asap to make sure garena isn't doing something fishy with their servers, like milking of servers for other purposes. I highly suspect that's what's happening. Every player on my and enemy team lags every game. Garena is destroying lol in sea and alrdy so many people stopped playing. If my ping doesnt reduce, i might have to do the same",Fix your servers plz
436,leagueoflegends,,BEHOLD FIDDLESTICKS 3.0 | The terror of demacia...
437,leagueoflegends,FIX THIS FUCKIKG CLIENT!!! WHAT ELSE AM I SUPPOSED TO DO FOR 20 HOURS A DAY? PLAY VALORANT?!?!,FIX THIS CLIENT
438,leagueoflegends,"Did a quick painting of T1's man in the midlane, Faker! 

Recently watched their match against DRX, im super hyped for LCK Finals!",[FANART] T1 Faker
439,leagueoflegends,I played vs vayne top / had a vayne top on the enemy team at least 5 times the past 2 days. I dont think its op but its very annoying when your a champ that sucks vs her. Has anyone been vsing vayne top more often lately ?,Is vayne top with hail of blades becoming more popular top this patch?
440,leagueoflegends,,Wow 😍😍😍😍😍 Sauce: from facebook:Nguyễn Thục Chi
441,leagueoflegends,,Wow 😍😍😍😍😍 Sauce: from facebook:Nguyễn Thục Chi
442,leagueoflegends,"#  Tristan 

Played professionally as an AD Carry for about 2 years 

# [Check His Coaching](https://www.bygamer.com/top-booster/view/1245?utm_source=reddit)

https://preview.redd.it/7sqqyvc24ju41.jpg?width=1500&amp;format=pjpg&amp;auto=webp&amp;s=1e74d66c5cb2df72da9a8d0d18d6e4d170bc3bfa",Champion !Champion !Champion !
443,leagueoflegends,,My first steal as Yuumi. I hope you like it (:
444,leagueoflegends,"I hate smurfs. I don't care if they're on my team and carrying me to victory or destroying me on lane and carrying the enemy team. It's not the carrying I hate. It's the attitude.

Since they're obviously better than the elo they're smurfing on and are not playing on their main account (which makes them not care about losses or reports) they act in all their arrogance; like they were the messiah in our ""trash"" elo, gifting us the LP - but also willing to take it away from us at any given moment, should we not cooperate in adoration. 

Who hasn't had a smurf in their game who got autofilled or simply didn't like something and immediately started threatening the own team with trolling/inting/afk'ing. How is it fair to be kept hostage by a player who knows he's better and can singlehandedly win or throw a game? For any player who's in it for fun or for the grind can't even be honestly happy for the win. Because it's not earned. It's not fought for, it's gifted by a smurf who most probably looks down on you - maybe even flames you in the process. Calling you stupid for trying your best (which obviously isn't as good as his best). 

It's nothing but a big circle jerk for them at the expense of the rest of the players. And it sucks. And I know Riot can't really do anything against it (or maybe they can, Idk), but it takes away so much from the game.",I hate smurfs.
445,leagueoflegends,,First time posting here:) hope you like it (still in progress)
446,leagueoflegends,So since anivia can spam walls could you theoretically stop a minion wave and stack a massive amount of minions to either farm or set lose your own to run it down mid?,Anivia on urf
447,leagueoflegends,,tender juicy wombo combo
448,leagueoflegends,I made a smurf last week and got it up to level 10. But the queue times for a normal draft take longer than usual. I have to wait around 5-10 minutes to find a match whereas it takes less than 30 seconds to find a match on my main. Is there any way to fix this?,Smurf queue times?
449,leagueoflegends,"Is it true that having a good attitude towards the game, even in difficult situations is more important than mechanical skill inside the game? For instance a lot of games that aren't lost by any means are given up on where people afk/troll or simply ff too early?

Surely a percentage of those games can be won, even if it's as low as 20 or 15%?

How important is having good mental in low elo?",Good Mental at low elo
450,leagueoflegends,"Riot please bring back old gamemodes or just add new ones, OFA isnt fun and URF is boring to me it dosent have to be insanely unique just something aside from OFA and URF and TFT on the amount of time I spend in this game doing something different would be awesome to me, this is what seperates dota and league I prefer league heavily but dota has a ton of gamemodes and it adds a lot more to do in general even mobile mobas have gamemodes really? If a mobile moba can have 5-6 gamemodes why cant you have 2-3 new ones? Im just asking a new gamemode every 2 weeks at the least or even 2 new gamemodes a month I don't care long as I get them it would bring back some players I think and would be a good change of pace for people who play the game in general.",Bring back gamemodes!
451,leagueoflegends,,Juicy wombo combo
452,leagueoflegends,So kindred is death. So she finds people who are about to die. So where do they go. Probably in the land of the dead where mord is. But then how does Tresh get souls. Does he only have souls from people who die in the shadow Isles.,What I don't understand about the lore
453,leagueoflegends,[removed],So can we buff black cleaver or whaaatttf
454,leagueoflegends,,MY REACTION TO 'TALES OF RUNETERRA' (Before Glory &amp; The Raid)
455,leagueoflegends,,Malice showcases perfect Evelynn smite
456,leagueoflegends,,My URF 2019 Montage
457,leagueoflegends,"Hello! If anyone has an answer I'd very much appreciate it.

So my ""normal"" 43 ping when playing on the euw server changed 2 days ago, and only affected by memory 3 games when it then went down to a stable 25 ping. 
Is this due to my internet provider or is it Riots servers that is kind of improving?
Like I'm not complaining because 25 ping feels way better than 43 ping soooo, maybe someone has an answer or option to keep it that way?

Thanks",Stable ping changes differentiating from game to game
458,leagueoflegends,"Hi I'm new to league and I recently tried to convert my garena shells to rp in league but when ever I I try to open up the rp store, it says ""you have no character in this app"". Can anyone help me out?",Can't exchange shells to rp
459,leagueoflegends,"Hi, this is my take on why I believe voice communication is a necessity and it is atrocious that it is not in the game already. 

First of all, I would like to talk about League of Legends solo q as a whole. 5 players playing different roles with different functions are put into a game against 5 other players. Both teams are attempting at the same goal, to destroy the enemy nexus. The most important part of League of Legends is teamwork. Being able to work together must forgo to achieve the goal you are sharing with your team. League of Legends is a team game. 

Team games require each other to work together. However, the only tools we are given to achieve such a feat are pings and typing in chat. These are not enough as comms allow for much more information given and got. Information is key in League of Legends as each player is piloting a different perspective that allows different information to solely you. Being able to disclose such information is the first step in teamwork and team play. Such is why voice communication is so important in team play. The fact that we have no access to a vigorous communication system such as voice comms, we as solo q players are unable to work together wholly as we could. 

Every tier on the ladder would benefit from having voice communications. These are the reasons why  I believe so.

The level of play would exponentially grow the higher on the ladder you went. Players would be able to grow more efficiently by having access to different perspectives of the players they are playing with.  Games in solo q are known to be a mess. But sometimes they are not and the majority of those times are simply because everyone is on the same page. High tier play as in Diamond and above would increase heavily as these players are accustomed to their understanding of League of Legends and are able to make smart decisions...in the majority of the time. 

Voice communications would directly result in a better quality of solo q. This is a subject voiced and opinionated by many as complaints of the ladder, especially in high elo, are quite frequent. North American Solo q is commonly understood as being inferior to the bigger regions such as EUW and KR.  Some of the common phrases describing solo q in NA is a ""for fun region"". Levelling up the play in high elo solo q would not only deny the idea of solo q in NA being for fun but also increase the average motivation for players wanting to win. 

Communication is a motivator for players wanting to win. By tearing down a layer of privacy and using your voice to communicate, players are automatically more invested in winning. Communicating with your team regarding the game and how to play it is proof of your investment that you want to win. This idea will directly result in a more positive experience. 

Now unto the most debated topic, toxicity. 

Emil Nordlander, states in his Thesis on "" The different emotional effects of voice and text communication in a game environment,"" that ""People acted/reacted more relaxed and cheerful and could easily chat and understand and support each other when using voice chat."" Public voice chat in League of Legends will not be without toxic individuals however it will be at a lower percentage than a simple chat box which we have now. Flaming in-game by typing is a lot easier than flaming via voice chat. By removing that layer of privacy you are more involved and invested in the game, thus directly lowering the chance of aggressively flaming your teammates. 

I personally love League of Legends. I think it is meant to be played as a team and not as an individual. Terms like ""1v9"" only exist because there's an idea that you are also playing against your teammates. Why not play with your teammates to the full extent as its meant to be done anyway?",Voice Comms in Solo q is a Necessity
460,leagueoflegends,"I have bad cs, i get killed under turret by bullies and lured out of lane by late game champions when they freeze the lane.

They have more cs and kills than me, usually end up warding my bush to be immune to ganks. They have control wards everywhere. 

How am i being matched against these people? I dont play ranked because that didnt do anything for matching me near my skill level. Just another bunch of stomps. Normals is just the same, ive been playing for so long and i cant get any better when i am dead half the time.

I cant even play safe, because these ""smurf""s or whatever know how to make that strategy useless. I do follow guides, and i look up my counters and what counters the champion im playing against, but that still doesn't help if they are practically a god.

This game makes me feel like crap trying to learn, i just end up dying like last time, only with a little more cs or a ward here or there.",Why is it so hard to match me near my skill level?
461,leagueoflegends,"I was plat last season and just did my provisionals. I'm bronze 1 after winning 9/10 and seem to gain 33LP per win. Does this mean I'll skip tiers when I rank up? Or will i just get to promos faster and lose less lp? I'm not entirely sure how it works, I'm hearing different things from friends.",Question about ranked
462,leagueoflegends,"First of all this would only provide autofill protection if support is within the roles you have chosen, but for me personally I just really don't like getting jungle, I love playing all the other roles equally and therefore most games I autofill and this is the one tiny issue that bothers me.","When queueing up for a league match, we should be given the option to fill except for a certain role."
463,leagueoflegends,,Biggest riot diff I’ve seen
464,leagueoflegends,,FUCKIN RIOT DIFF
465,leagueoflegends,"Hello Summoners,

I really enjoy watching competetive League of Legends and I´d really like to also participate and experience competetive matches (draft, strategies, etc.).   
I want to ask if there are any low elo tournaments/leagues on EUW (like Silver/Gold ranks). Clash is nice but doesnt feel like an actual tournament or an actual League since you only play up to 3 games.

Thank you in advanced",LOW ELO Tournaments (?)
466,leagueoflegends,"I have not been able to spectate my friends games. Whenever I go to the ""spectate game"" option under his username its always greyed out. Is there a setting or anything I could be missing?",Why can't I spectate my friends game?
467,leagueoflegends,[removed],Why can't I spectate my friends game?
468,leagueoflegends,[removed],why cant i spectate my friend on league?
469,leagueoflegends,"Hello!

  
Recently I came back to LOL after 2,5 years.   
It turned out most of my friends from EUNE left the game and I have many friends who are playing on EUW region.

I tried to find option to change region for RP. I couldn't find it. Is there any way I can change my region? 

&amp;#x200B;

Kind regards",How can I change my region?
470,leagueoflegends,,Insane Amumu Outplay
471,leagueoflegends,"I am a fairly new player and I really enjoy playing this game. So I considered buying Galaxies 2020 Pass only a couple of days ago. However, I doubt that it is worth to buy it 4 days before it's ending. 

So do you guys suggest me to get it or wait for the next event?

P.S. I accumulated 1000 Tokens already and if I understood it correctly I will be able to collect them once I purchase the Pass.",Galaxies Pass Still Worth It?
472,leagueoflegends,,So uhh. I got a level 3 mech today.
473,leagueoflegends,"Hello to all! I've a fast questions, yesterday I was playing illaoi Vs a a kayn top. So, we start a trade and I ult him, so he ulted me to ""hide in me"" and avoid my tentacle rape, but actually doesn't work. My tentacle hits him even if it was untargettable in me. It's supposed to work like that? My tentacle can still hit him?",Kayn and illaoi ults interaction
