,subreddit,selftext,title
875,leagueoflegends,"I met a girl who wouldn't stop talking.

So I silenced her.

...with my charm. Hm? What were you expecting me to say? I'm not comprised of poison, you know. Fear not, for I am here to heal, not smite. Especially when the world is in need of more people who are not blind to the fact that our society needs to be revived.

We must rally against those tyrants who only plan to lifesteal from the prosperous. We need to stun them in their tracks to slow their spread. They won't have a ghost of a chance once we stifle the barriers which protect the root of their power.

The time has come to surge our offenses and cleanse the calamity caused by those of the darkness who lack clairvoyance. Granted, we will need to fortify our resistances without exhausting our resources. Their rage is not beyond our control, so let's get in range and purge these foul beasts with silver.

Because at the end of day, don't you think it'll be worth seeing the plethora of flashing smiles across all those whom we've saved?

I sure do. We can do all of this without a map.",Short Story about League of Legends (2010)
876,leagueoflegends,"If your support gets caught by enemy Blitz a couple times, it’s annoying. I get it. But if you troll them, you’re clouding their head with more frustration, shame, and/or comebacks instead of playing well. Isn’t that obvious? There’s no ambiguity when it gets to the point where Blitz grabs them again *while* responding to you. 

“Inting?” Really? The only thing your support is **int**entionally doing is to playing a game—and the thankless role of support no less. Why would they intentionally feed the enemy, making it *harder* for the player they‘re trying to support? 

The only one “intentionally” making things worse is the toxic player with the bad attitude dragging everyone down, and preventing a possible comeback.

Oh by the way, to anyone thinking about posting “this sounds like it happened to you,” or “lol u mad,” yes.

——————  
Edit: I’m mostly wondering why this is such a widespread issue because people put so much effort into improving their game, from watching videos online, studying the pros, even subscribing to online coaching sessions. This seems like a super impactful, *free* way to get themselves a higher win rate, but so many players just leave that money on the table.",How do so many players in this game not see the connection between their own toxicity (insulting/blaming their own teammates) and their teammates’ poor performance? It’s so obvious.
877,leagueoflegends,[removed],Need some help Framerate capped at 30fps
878,leagueoflegends,[removed],Riot should overthink afk punishment
879,leagueoflegends,,I CANT BE THE ONLY ONE. (not a bad thing tho) made this a while ago
880,leagueoflegends,https://www.youtube.com/watch?v=rm0vEGYC1Gk I am the Thresh in this clip. Aphelios was only 1 lvl above us and I hooked him under tower and he literally 1 shots both of us. Why does a champion exist that is allowed to just make any mistakes he wants  and can just press R and then heal his entire hp back in seconds?,Why has Riot not NERFED Aphelios yet? Why do they think this is okay?
881,leagueoflegends,[removed],Why has riot not nerfed aphelios? why do they think this is okay?
882,leagueoflegends,,xQc Reacts to '' Most Popular Streamed Games 2015 - 2019 '' ( WITH CHAT )
883,leagueoflegends,[removed],Battle Academia Lux Fan Art - (TOAST!!!)
884,leagueoflegends,"&amp;#x200B;

Guys, just look at the photo I've send.

So there is me at top playing as garen, everything going good at the first 10 minutes... But then Ashe want to feed and Soraka too.

Then Jhin is so feed and I lose the game because of Ashe and Soraka. Ekko was doing good, I was winning my lane in cs and kills at the start, and then jhin got soo fed, and at that point we lose the game.

What can I do (im about to go through my monitor with my head)

btw silver 4 rank

[only positive vibes :\)](https://preview.redd.it/65whb3t98gu41.png?width=778&amp;format=png&amp;auto=webp&amp;s=300b58d0c54bf4412d2e268b8d1353a8a64ec173)","Please help me guys, I can't play I have this problem every game."
885,leagueoflegends,,Just to show how bot lane is a useless and this game is legit balanced and finally always getting the worst feeder ever
886,leagueoflegends,[removed],PLEASE HELP ME IM GOING TO RAGE I CAN'T ANYMORE
887,leagueoflegends,"While we can argue the semantics around solo queue even allowing premades in the first place, Riot wants two people (sucks if you have a third friend) to be able to play together. In all my years of playing League, the one thing I have noticed is that if both players are roughly the same ELO and go bot/supp together, but the other team splits their premades across lanes, an overwhelming majority of the time the bot duo will smash their opponents in bot lane.

In order to deal with this, perhaps Riot should force duos to go bot lane together?",Should premades be forced to go bottom together?
888,leagueoflegends,"I filed a LoL support ticket, but they haven't answered and it looks like they won't in nearest future. Maybe somebody can help me with this issue:

 I am getting disconnected approximately every 5-10 minutes. I see attending to reconnect screen and the only fix is to Alt F4 out of the game and reconnects again. My ping doesn't drop, neither my connection gets lost. This is happening only with LoL and no other game/app/website. I tried to reinstall the game, update drivers, use hextech repair too, change setting to prefer Ipv4 instead of Ipv6, and also tried to change the frequency of the router from 2.4ghz to 5ghz. I am connected to home wifi, which is decent enough to run 2 firesticks with Youtube tv and several mobile devices at once. I tried to turn off every device but the disconnecting keeps happening.",Attempting to reconnect issue
889,leagueoflegends,[removed],I haven't seen the after-game screen in weeks.
890,leagueoflegends,[removed],SOMEONE PLEASE EXPLAIN TO ME WHY THIS HAS NOT BEEN NERFED?
891,leagueoflegends,"They just take too much botlane power(which is enormous tbh). ADC gameplay is all about ""your supp gonna pick any engage/hook sup or gonna let you play 1v2 lane "" vs something like lane bully adc+ hook/engage supp?  I am ok about ""everything can oneshot me, even enchanter"", but right now adc just feels like his support slave. You can't walk alone, you can't carry anythin solo and you just free food for everyone when you are solo. Why riot refuses to nerf supports?","I can't speak for all, but suppot difference is the main problem in actual botlane"
892,leagueoflegends,,Someone PLEASE explain to me why this has not been Nerfed?
893,leagueoflegends,"Is it wrong To be Toxic/Mad at a teammate who went 0/10/0 as an adc

Now i understand that toxicity is wrong, but is it wrong of me to get mad at them for literally ruining my entire game experience/ 30 minutes of my life.

And why does everyone think toxicity is ""childish""? adults shouldn't get mad at things they care about? or are people saying i shouldn't care about league?

I'm saying i think my anger was justified and it's ok to care about a game to the point of where you dislike people ruining it, if anyone disagree's with me or can answer my question please post why.",I am here to ask another question
894,leagueoflegends," 

So I played a solo ranked game and this Jarvan was in it. [https://euw.op.gg/summoner/userName=KRAL+B%C3%9CKEN](https://euw.op.gg/summoner/userName=KRAL+B%C3%9CKEN)

I  am currently Plat 3. So my question is, how the fuck a player without  any rank for any seasons and chain losing 9 games in a row is in my game  ? the guy was just Bronze lvl at best im not kidding. he is buying  tabi's against 4 ap champs lol",Why is this guy in my game ?
895,leagueoflegends,[deleted],The fact that LeBlanc's ultimate is TRASH
896,leagueoflegends,[removed],RIP euw ?
897,leagueoflegends,[deleted],Coffin Dance Meme League Of Legends Pro Player One Shots
898,leagueoflegends,[deleted],What if Riot just removed boots.
899,leagueoflegends,[removed],The fact that LeBlanc's ultimate is TRASH
900,leagueoflegends,"Every game I press tab and check who has healing to decide to buy anti healing or not, but almost every game nowadays have 3+ champs that heal a lot.

A big problem right now are the items, normal champions who don't heal very much normally buy items that heal a lot. I.e. wukong, normally doesn't heal, but he buys blade and death's dance and suddenly he lifesteals like a pre-rework sion ult. Champions in the meta right now abuse items that provide lifestea: blade, death's dance, ravenous hydra, gunblade, protobelt, GLP, sanguine's. 

The current anti-healing items feel very lackluster compared to what you can build that gives you lifesteal. An executioners costs 800g but only gives you +15 ad and is an inconvenience that takes up an item slot. For AP champs to get anti-healing you need to buy a full item of 3000g to get the effects. The only one that does not feel awful to buy is bramble vest, and that is only if you are on a tank and the enemy is heavily ad. The grevious wounds effect also only lasts for 3 seconds and cuts the healing by 40% which feels like it doesn't do anything at all most of the time.

Bonus rant as an ADC main: These bruisers just build items with damage and get healing and lifesteal anyways. As an adc, you heavily need the lifesteal to protect yourself from any sneeze from a mage or bruiser that put you on 25% hp. Problem is, most adc's can't build lifesteal until at least after 2 or 3 items. All they have is Legend: Bloodline, which needs time to stack. To rub salt in injury,  marksmen need to waste 800g and an item slot just to deal with 40% of the healing. And almost always you have to choose between either that or a qss, because getting both means a cannon minion deals more damage than you.",Healing and lifesteal are getting out of hand in league and the grevious wounds options are lackluster
901,leagueoflegends,[deleted],God King Montage with cinematic
902,leagueoflegends,Check out this clip! stefandiff streaming League of Legends!  https://clips.twitch.tv/BumblingSpicyMacaroniShazBotstix,Malp With The Best Reaction Time :)
903,leagueoflegends,,Main Kindred
904,leagueoflegends,[removed],Why this guy is in my game ?
905,leagueoflegends,[removed],"With Valorant being able to check how long you have been watching streams over on Twitch, why havnt League added this for their missions?"
906,leagueoflegends,[removed],Battle Academia Lux Fan Art - (TOAST!!!)
907,leagueoflegends,[removed],Typical Day on the Rift
908,leagueoflegends,[deleted],My Splendid Staff Nami cosplay :)
909,leagueoflegends,[removed],Did anyone else quit playing Sona because of this?
910,leagueoflegends,,When you can't even pick a champion...
911,leagueoflegends,"Hello and welcome to another reminder of: Please don't give up, if you have a scaling team!

Today's special and tilted guest: Wukong!

&amp;#x200B;

[GG! 5 mIN tIlL ff. LeT'S OpEn1!](https://preview.redd.it/cing1t583gu41.png?width=314&amp;format=png&amp;auto=webp&amp;s=90d3e68e6073b94adb5b08c374fa19f178425f4b)

But let's get real. I am an Azir lover.

And if you didn't know yet, Azir is a scaling champ. What really grinds my gears are player the following Wukong from one of my last games. Why? Well, let me explain.

First let me show you my team composition and the enemy one:

Our comp:

1. Kayle: Great Scaling, Peel, High DPS
2. Wukong: Great early- and midgame, even nice in lategame, engage + peel
3. Azir: Insane scaling, zoning control
4. Caitlyn: Good early and late game, zoning control
5. Thresh: Insane peel, engage/catches

Enemy comp:

1. Renekton: Great earlygame, later on a meatball if not ahead
2. Evelynn: Insane snowball  possibility, great to kill enemy carrys
3. Sylas: great scaling into midgame
4. Vayne: Insane scaling with 1v5  possibility
5. Soraka: Great to help Vayne survive the laning phase

Overall i would say both teams had a good team composition. And now the important thing, you should always think about: The winning conditions.

Our winning condition was to scale, maybe even get some catches and try to feed as little as possible. Sounds easy? Not in SoloQ. What happened was the following:

&amp;#x200B;

[Wukong died once and gave up. It was 0-1 and we were 5 min ingame.](https://preview.redd.it/2ky44zwe1gu41.png?width=364&amp;format=png&amp;auto=webp&amp;s=b84b2e1813b782280e57ce49a770d15e7477cc7b)

But let me tell you, Soloq is super random. People like to tilt, some even RQ or get disconnected. And hellyeah I got great team member this time. No one got tilted by him. Everyone ignored him or muted him like me. We let him spam his surrender votes and scaled. And at the end? The enemy Vayne got caught, got flammed for it and rq. She was the only threat in lategame for us and we won that game after 29 min, just because we didn't give up.

So if you find yourself in a moment of tilt like that Wukong, please press tab and think about winning conditions. ^(But please leave League, if u tilt after First Blood)

Cheers",About Tilt and Winning Conditions
912,leagueoflegends,[deleted],Hitboxes discusion!- riot pls fix
913,leagueoflegends,"Over the past year, Rakan has been changed multiple times. In both patches 9.2 and 9.9, Rakan's kit was changed for the stated reason of lowering his competitive presence. These changes altered the feel of his kit significantly by slowing his W speed down and putting a casting time on his ultimate. So, did these changes truly lower Rakan's presence? Between the play ins and first half of the group stage at Worlds 2019, Rakan is currently at a 62% presence, which is undeniably high. Was the added clunkiness to Rakan's kit worth his small decrease in presence? If only there was a way to have kept the fun, fluid feel of Rakan's kit without having him be overpowered in competitive. Well, before the patch 8.6 buffs, Rakan was perfectly balanced in competitive play &amp; solo queue. In patch 8.6, Rakan received buffs to his E range and Q AP ratio. After these changes, Rakan became widely popular in the competitive scene. Before patch 8.6, though, Rakan was only ever picked with Xayah due to his E range making his engages more risky when not with Xayah. Take the 2018 spring split (which occurred before patch 8.6) as an example. In the LCK, LPL, NA LCS, &amp; EU LCS, Rakan had under a 35% presence in every major region throughout the whole split. 

https://lol.gamepedia.com/EU\_LCS/2018\_Season/Spring\_Season/Champion\_Statistics https://lol.gamepedia.com/NA\_LCS/2018\_Season/Spring\_Season/Champion\_Statistics https://lol.gamepedia.com/LPL/2018\_Season/Spring\_Season/Champion\_Statistics https://lol.gamepedia.com/LCK/2018\_Season/Spring\_Season/Champion\_Statistics 

As you can see, Rakan was not the pro play menace he currently is, even with his old RW engage. Rakan is particularly popular right now in season 10 in the LEC, where he resides at a 65% presence throughout the regular split. 

Conclusion: So, I, alongside many other Rakan players, find that the current changes (casting time) have made Rakan overall less fluid &amp; fun. The casting time has taken away some of Rakan's playmaking potential significantly. Since Rakan's pickrate in competitive is still somewhat high (as of season 10), future nerfs / changes are not out of the question. I feel the best course of action would be to revert Rakan to his pre patch 8.6 state (before the E range buffs). Before patch 8.6, Rakan had a decent winrate in solo queue, a moderately low competitive presence, and had his old, fun kit (the old RW combo). Like what was done with Rengar and Leblanc in the past, Rakan should be reverted back to the days when his kit was not altered by nerfs and his competitive pick rate was lower than it is now.",Rakan Ultimate Casting Time
914,leagueoflegends,,Interesting Predator bug i just found
915,leagueoflegends,[removed],"Drinking Game : Take a Shot Every Time I Say Wtf (and btw this bug is annoying as hell , did it happen to u guys too?)"
916,leagueoflegends,"They just hauled back on the dodge punishments, but wheres the timeline for giving us control over the people who ruin the games and champ selects? 

&amp;#x200B;

Why when I have a teammate who feeds FB at 30 seconds into the game and then RQs, do I still have to play 15 minutes of that game. Why can't we Remake, and why do I still lose full LP if I lose that game?","Every survey I've ever done has always had things like ""Leavers and Inters have too much power over my games"" So if they're aware of the problem, why isn't it fixed?"
917,leagueoflegends,,Apple music
918,leagueoflegends,[removed],"Confession: I would love to work for Riot Games in the future, specifically in the League balance team."
919,leagueoflegends,,Streamer Teddy in pro play
920,leagueoflegends,[removed],Yone teaser is finally here!
921,leagueoflegends,[removed],What would you do here?
922,leagueoflegends,,New client feature? (Dark mode)
923,leagueoflegends,,What would you do here?
924,leagueoflegends,[removed],Matchmaking discourages players from previewing their selective role before ban phase
925,leagueoflegends,"Games end so quickly no it's insane. I think that's why early game junglers are STILL strong despite 10% xp nerfs to ganks early game. The 2 base turrets probably have to quickest 100-0 lifespan out of all they last about 2 seconds of hitting. This makes fighting in your base less of an advantage and more of a disadvantage as minions do more than turrets.

A lot of games feel so helpless nowadays.",I think base turrets need more health
926,leagueoflegends,,"Hashinshin ""discussing"" a balance of the game with viewer."
927,leagueoflegends,[removed],Battle Academia Lux Fan Art - (TOAST!!!)
928,leagueoflegends,,Alistar Airlines coming to an airport near you.
929,leagueoflegends,,Fixing LoL's Boring Champs: Zyra
930,leagueoflegends,[removed],goodbye
931,leagueoflegends,[deleted],Is this a Shrek Reference?
932,leagueoflegends,[deleted],Alistar Airlines coming to your airports this fall
933,leagueoflegends,,Just realized miss fortune is like misfortune
934,leagueoflegends,[removed],Hacked through league?
935,leagueoflegends,,As an ADC that had enough
936,leagueoflegends,,Juicy pink ward
937,leagueoflegends,"So when I googled it I saw that this was a problem a few years ago but I haven't found a solution for me. I have Windows 10 and when i play league it randomly minimizes to desktop. I play on a laptop but i don't have any problems with frames or lagging, it can handle the game. At first I thought I was pressing some button by mistake but i noticed even when I only click it happens. It also only happens when I play pvp, when I play vs bots I don't have a problem.",when i play it minimizes to desktop randomly
938,leagueoflegends,"With all this time on my hands I have been watching a lot of current League and also great League matches from the past. Some of the casters have stuck around and others have moved onto other career paths. I have always found that League of Legends matches can be elevated to even greater heights with great casting, and for me is a very important aspect while watching.",Who is your favorite english caster and why? Who is your least favorite and how could they improve?
939,leagueoflegends,,From the Rift Up: learn Kai’Sa in 4 and a half minutes
940,leagueoflegends,"This shit was seriously so fun.   
I told the top, I was like “look, I’m jungle, I gotta make choices, I’m gonna gank you once early then camp bot”.   
The top fiora was 0/4 till late game said to me “keep doing what you’re doing. We’re in the endgame now”

From that point on I rushed bot gave ridiculous behind-the-turret ganks getting our Vayne double kill after double kill.    
The support, a first time lulu, because we convinced her to play lulu in champ select so that all our champs were pink and purple (fio, vi, syndra, Vayne, lulu) learned to only ever ult vayne.   

We were playing against a zyra, a morg, and a lux. The snares were CRAZY! But my vi ult is unstoppable so I baited them, ulted, then cc’d enough to get vayne ahead. When they stopped going for me, our GOD TIER vayne would dodge almost every single one but ult-rolling to the side.     

By the end, the entire team was just following vayne, cc for her, facechecking bushes for her, die for her if we had to. Like a League version of pretext the president. We were UNSTOPPABLE",Just played a game with Vayne
941,leagueoflegends,"I always hear it - You have 500 games and you're in Gold! Pathetic.

I can imagine I could become Plat and still hear this, just curious what Rank one should be with 500 games played. This is only my second season and I came from Bronze with a terrible WR% which if you look at my recent games you can see that my WR has improved a lot.

Just curious if this ever stops and/or what rank I should be with 500 games",Do the chirps ever stop in RANKED PLAY?
942,leagueoflegends,,How League of Legends bolstered a $25B industry and the wave of failures that followed
943,leagueoflegends,,Cloud9 League of Legends Montage | 2020 LCS Spring Split | Don’t you wanna be a SUPERHERO
944,leagueoflegends,,the spawn warden build
945,leagueoflegends,[removed],TIL Thornmail causes turret aggro
946,leagueoflegends,,FlyQuest is the most wholesome Org that will ever exist! Happy Earth Day!
947,leagueoflegends,I just played with someone who had a blue heart emoji as their club tag. How do you do that? I tried setting my club tag to an emoji but it says its not allowed.,Emojis in club tags?
948,leagueoflegends,[removed],Buff
949,leagueoflegends,[deleted],Is this a motherfucking Shrek 2 reference?
950,leagueoflegends,"Recently someone pointed out that his theme didn't really match his gameplay. So I can with a sort of mini-rework that might be able to address this:

* Slight change to Q fear passive: 
   * Enemies are now feared when an enemy champion is isolated rather than you are unseen. This has a static cooldown after use of an ability.
* The second change to his Q passive. Now you are unseen or stand still for a while ones you move towards an enemy champion when he's within a specific range you will move on 4 legs similar to the trailer: [https://youtu.be/jNn2F39G-6s?t=60](https://youtu.be/jNn2F39G-6s?t=60). In this state you will have the following effects:
   * You gain enhanced movement speed while walking towards enemy champions
   * You will be able to ult but without the channel and the blink but ult will no longer apply fear.
* His ult now always fears unless in the hunt state from the previous point.  
* For his passive, enemies now are feared briefly (let's say 0.5 to 1 seconds) when destroying an effigy, this will happen 1 second after effigy is destroyed. If fiddle is nearby he automatically goes into the hunt state when he's within range while the enemy is feared from the effigy.

This could help his early ganks a bit as well making effigies more dangerous. If the enemy is tricked and attacks the edgy he gets that brief fear and people will be in terror because they think fiddle is nearby and can kill them now.",Idea for fiddle on how to make him match his theme
951,leagueoflegends,"Hi! I don't know since this belongs here because I'm new to this subreddit; but quarantine has me bored to death, I downloaded LoL again and started playing again, and I found the game really enjoyable this season. I'm trying to relearn the game again but I feel like I'm at a difficult spot because I'm not a complete beginner yet I have no clue how the game works at the same time.  


Can someone recommend me some guides or videos to relearn the basics again? I stopped playing at s4-s5 (around league of tanks tbh) and only played sporadically since then. Thank you so much!","Back in the game, need help realearning."
952,leagueoflegends,[deleted],Battle Academia Lux Fan Art - (TOAST!!!)
953,leagueoflegends,,The multiple posts about the pass nerf making front page without one Riot reply shows they use Reddit to promote their game and they don't care about Reddit unless it makes them money.
954,leagueoflegends,,Is this a Shrek reference
955,leagueoflegends,"It's looks like:

\-Nooo you can't just revive yone , he dead!!!!! 

\-Haha, darkin Yone go brrrr

I believe it's him from first day 2020 champions video, because it's ionia, it's popular champ, he have katanas, Yone is good name (unlike general de katou),  and he refuse to die. 

https://preview.redd.it/61zykp57tfu41.jpg?width=1520&amp;format=pjpg&amp;auto=webp&amp;s=43e7b2c4e40b815a6fec0513118f20f820b5af9c",What happens on Reddit if Yone was released
956,leagueoflegends,"With how fucked up the client is after all these years, I wonder if it’s possible for Riot just ditch the client entirely, and use in game menu like Valorant and LOR, and any other functioning video games out there (Rainbow Six, Overwatch, CSGO, etc). With the new Riot Client being able to launch multiple games, I really don’t see a reason for them to keep this garbage league client, and instead they should make the Riot Client like Battlenet to launch games and makes League a stand-alone program with its own main menu.",Is is possible for Riot just ditch the client entirely?
957,leagueoflegends,"I've been trying to install the game for about 4hrs now and I can't open the tutorial without it crashing. It starts the 5 min timer to try and fix the issue, but it always crashes again and restarts the timer. I've tried reinstalling and using the repair feature.. Anyone got any ideas?",Crashing when trying to start tutorial
